[
  {
    "id": "w_tas",
    "lemma": "tas",
    "pos": "zn",
    "article": "de",
    "plural": "tassen",
    "verb_forms": null,
    "separable": null,
    "forms_seen": [],
    "zh": "包",
    "en": "bag",
    "zh_nn": "包",
    "en_nn": "bag",
    "first_lesson": "NN05",
    "lessons": ["NN05"],
    "audio": "audio/words/w_tas.mp3",
    "audio_source": "tts:nl-NL-FennaNeural",
    "flags": []
  },
  {
    "id": "w_pan",
    "lemma": "pan",
    "pos": "zn",
    "article": "de",
    "plural": "pannen",
    "verb_forms": null,
    "separable": null,
    "forms_seen": [],
    "zh": "锅",
    "en": "pan",
    "zh_nn": "锅",
    "en_nn": "pan",
    "first_lesson": "NN05",
    "lessons": ["NN05"],
    "audio": "audio/words/w_pan.mp3",
    "audio_source": "tts:nl-NL-FennaNeural",
    "flags": []
  },
  {
    "id": "w_net",
    "lemma": "net",
    "pos": "zn",
    "article": "het",
    "plural": "netten",
    "verb_forms": null,
    "separable": null,
    "forms_seen": [],
    "zh": "网",
    "en": "net",
    "zh_nn": "网",
    "en_nn": "net",
    "first_lesson": "NN05",
    "lessons": ["NN05"],
    "audio": "audio/words/w_net.mp3",
    "audio_source": "tts:nl-NL-FennaNeural",
    "flags": []
  },
  {
    "id": "w_bed",
    "lemma": "bed",
    "pos": "zn",
    "article": "het",
    "plural": "bedden",
    "verb_forms": null,
    "separable": null,
    "forms_seen": [],
    "zh": "床",
    "en": "bed",
    "zh_nn": "床",
    "en_nn": "bed",
    "first_lesson": "NN05",
    "lessons": ["NN05"],
    "audio": "audio/words/w_bed.mp3",
    "audio_source": "tts:nl-NL-FennaNeural",
    "flags": []
  },
  {
    "id": "w_vis",
    "lemma": "vis",
    "pos": "zn",
    "article": "de",
    "plural": "vissen",
    "verb_forms": null,
    "separable": null,
    "forms_seen": [],
    "zh": "鱼",
    "en": "fish",
    "zh_nn": "鱼",
    "en_nn": "fish",
    "first_lesson": "NN05",
    "lessons": ["NN05"],
    "audio": "audio/words/w_vis.mp3",
    "audio_source": "tts:nl-NL-FennaNeural",
    "flags": []
  },
  {
    "id": "w_pin",
    "lemma": "pin",
    "pos": "zn",
    "article": "de",
    "plural": "pinnen",
    "verb_forms": null,
    "separable": null,
    "forms_seen": [],
    "zh": "大头针；刷卡机",
    "en": "pin; card terminal",
    "zh_nn": "大头针；刷卡机",
    "en_nn": "pin; card terminal",
    "first_lesson": "NN05",
    "lessons": ["NN05"],
    "audio": "audio/words/w_pin.mp3",
    "audio_source": "tts:nl-NL-FennaNeural",
    "flags": []
  },
  {
    "id": "w_de",
    "lemma": "de",
    "pos": "lidw",
    "article": null,
    "plural": null,
    "verb_forms": null,
    "separable": null,
    "forms_seen": [],
    "zh": "（定冠词，用于 de 词）",
    "en": "the",
    "zh_nn": "（定冠词，用于 de 词）",
    "en_nn": "the",
    "first_lesson": "NN05",
    "lessons": ["NN05", "NN21", "NN22"],
    "audio": "audio/words/w_de.mp3",
    "audio_source": "tts:nl-NL-FennaNeural",
    "flags": []
  },
  {
    "id": "w_het",
    "lemma": "het",
    "pos": "lidw",
    "article": null,
    "plural": null,
    "verb_forms": null,
    "separable": null,
    "forms_seen": [],
    "zh": "（定冠词，用于 het 词）；它",
    "en": "the; it",
    "zh_nn": "（定冠词，用于 het 词）；它",
    "en_nn": "the; it",
    "first_lesson": "NN05",
    "lessons": ["NN05", "NN22"],
    "audio": "audio/words/w_het.mp3",
    "audio_source": "tts:nl-NL-FennaNeural",
    "flags": []
  },
  {
    "id": "w_in",
    "lemma": "in",
    "pos": "vz",
    "article": null,
    "plural": null,
    "verb_forms": null,
    "separable": null,
    "forms_seen": [],
    "zh": "在……里",
    "en": "in",
    "zh_nn": "在……里",
    "en_nn": "in",
    "first_lesson": "NN05",
    "lessons": ["NN05", "NN22"],
    "audio": "audio/words/w_in.mp3",
    "audio_source": "tts:nl-NL-FennaNeural",
    "flags": []
  },
  {
    "id": "w_zijn",
    "lemma": "zijn",
    "pos": "ww",
    "article": null,
    "plural": null,
    "verb_forms": {
      "ik": "ben",
      "jij": "bent",
      "hij": "is",
      "wij": "zijn",
      "pp": "geweest",
      "aux": "zijn"
    },
    "separable": null,
    "forms_seen": ["is"],
    "zh": "是",
    "en": "to be",
    "zh_nn": "是",
    "en_nn": "to be",
    "first_lesson": "NN05",
    "lessons": ["NN05", "NN21", "NN22"],
    "audio": "audio/words/w_zijn.mp3",
    "audio_source": "tts:nl-NL-FennaNeural",
    "flags": []
  },
  {
    "id": "w_goedemorgen",
    "lemma": "goedemorgen",
    "pos": "tw",
    "article": null,
    "plural": null,
    "verb_forms": null,
    "separable": null,
    "forms_seen": [],
    "zh": "早上好",
    "en": "good morning",
    "zh_nn": "早上好",
    "en_nn": "good morning",
    "first_lesson": "NN21",
    "lessons": ["NN21"],
    "audio": "audio/words/w_goedemorgen.mp3",
    "audio_source": "tts:nl-NL-FennaNeural",
    "flags": []
  },
  {
    "id": "w_mevrouw",
    "lemma": "mevrouw",
    "pos": "zn",
    "article": "de",
    "plural": "mevrouwen",
    "verb_forms": null,
    "separable": null,
    "forms_seen": [],
    "zh": "女士，太太",
    "en": "madam, Mrs",
    "zh_nn": "女士，太太",
    "en_nn": "madam, Mrs",
    "first_lesson": "NN21",
    "lessons": ["NN21"],
    "audio": "audio/words/w_mevrouw.mp3",
    "audio_source": "tts:nl-NL-FennaNeural",
    "flags": []
  },
  {
    "id": "w_wat",
    "lemma": "wat",
    "pos": "vnw",
    "article": null,
    "plural": null,
    "verb_forms": null,
    "separable": null,
    "forms_seen": [],
    "zh": "什么",
    "en": "what",
    "zh_nn": "什么",
    "en_nn": "what",
    "first_lesson": "NN21",
    "lessons": ["NN21"],
    "audio": "audio/words/w_wat.mp3",
    "audio_source": "tts:nl-NL-FennaNeural",
    "flags": []
  },
  {
    "id": "w_willen",
    "lemma": "willen",
    "pos": "ww",
    "article": null,
    "plural": null,
    "verb_forms": {
      "ik": "wil",
      "jij": "wilt",
      "hij": "wil",
      "wij": "willen",
      "pp": "gewild",
      "aux": "hebben"
    },
    "separable": null,
    "forms_seen": ["wilt"],
    "zh": "想要",
    "en": "to want",
    "zh_nn": "想要",
    "en_nn": "to want",
    "first_lesson": "NN21",
    "lessons": ["NN21"],
    "audio": "audio/words/w_willen.mp3",
    "audio_source": "tts:nl-NL-FennaNeural",
    "flags": []
  },
  {
    "id": "w_u",
    "lemma": "u",
    "pos": "vnw",
    "article": null,
    "plural": null,
    "verb_forms": null,
    "separable": null,
    "forms_seen": [],
    "zh": "您",
    "en": "you (polite)",
    "zh_nn": "您",
    "en_nn": "you (polite)",
    "first_lesson": "NN21",
    "lessons": ["NN21"],
    "audio": "audio/words/w_u.mp3",
    "audio_source": "tts:nl-NL-FennaNeural",
    "flags": []
  },
  {
    "id": "w_een",
    "lemma": "een",
    "pos": "lidw",
    "article": null,
    "plural": null,
    "verb_forms": null,
    "separable": null,
    "forms_seen": [],
    "zh": "一个（不定冠词）",
    "en": "a, an",
    "zh_nn": "一个（不定冠词）",
    "en_nn": "a, an",
    "first_lesson": "NN21",
    "lessons": ["NN21", "NN22"],
    "audio": "audio/words/w_een.mp3",
    "audio_source": "tts:nl-NL-FennaNeural",
    "flags": []
  },
  {
    "id": "w_bruin",
    "lemma": "bruin",
    "pos": "bn",
    "article": null,
    "plural": null,
    "verb_forms": null,
    "separable": null,
    "forms_seen": [],
    "zh": "棕色的",
    "en": "brown",
    "zh_nn": "棕色的",
    "en_nn": "brown",
    "first_lesson": "NN21",
    "lessons": ["NN21"],
    "audio": "audio/words/w_bruin.mp3",
    "audio_source": "tts:nl-NL-FennaNeural",
    "flags": []
  },
  {
    "id": "w_brood",
    "lemma": "brood",
    "pos": "zn",
    "article": "het",
    "plural": "broden",
    "verb_forms": null,
    "separable": null,
    "forms_seen": [],
    "zh": "面包",
    "en": "bread",
    "zh_nn": "面包",
    "en_nn": "bread",
    "first_lesson": "NN21",
    "lessons": ["NN21"],
    "audio": "audio/words/w_brood.mp3",
    "audio_source": "tts:nl-NL-FennaNeural",
    "flags": []
  },
  {
    "id": "w_alstublieft",
    "lemma": "alstublieft",
    "pos": "tw",
    "article": null,
    "plural": null,
    "verb_forms": null,
    "separable": null,
    "forms_seen": [],
    "zh": "请；给您",
    "en": "please; here you are",
    "zh_nn": "请",
    "en_nn": "please",
    "first_lesson": "NN21",
    "lessons": ["NN21"],
    "audio": "audio/words/w_alstublieft.mp3",
    "audio_source": "tts:nl-NL-FennaNeural",
    "flags": []
  },
  {
    "id": "w_anders_nog_iets",
    "lemma": "anders nog iets",
    "pos": "uitdr",
    "article": null,
    "plural": null,
    "verb_forms": null,
    "separable": null,
    "forms_seen": [],
    "zh": "还要别的吗",
    "en": "anything else",
    "zh_nn": "还要别的吗",
    "en_nn": "anything else",
    "first_lesson": "NN21",
    "lessons": ["NN21"],
    "audio": "audio/words/w_anders_nog_iets.mp3",
    "audio_source": "tts:nl-NL-FennaNeural",
    "flags": []
  },
  {
    "id": "w_nee",
    "lemma": "nee",
    "pos": "tw",
    "article": null,
    "plural": null,
    "verb_forms": null,
    "separable": null,
    "forms_seen": [],
    "zh": "不，不是",
    "en": "no",
    "zh_nn": "不，不是",
    "en_nn": "no",
    "first_lesson": "NN21",
    "lessons": ["NN21", "NN22"],
    "audio": "audio/words/w_nee.mp3",
    "audio_source": "tts:nl-NL-FennaNeural",
    "flags": []
  },
  {
    "id": "w_dank_u_wel",
    "lemma": "dank u wel",
    "pos": "uitdr",
    "article": null,
    "plural": null,
    "verb_forms": null,
    "separable": null,
    "forms_seen": [],
    "zh": "非常感谢（礼貌）",
    "en": "thank you very much",
    "zh_nn": "非常感谢（礼貌）",
    "en_nn": "thank you very much",
    "first_lesson": "NN21",
    "lessons": ["NN21"],
    "audio": "audio/words/w_dank_u_wel.mp3",
    "audio_source": "tts:nl-NL-FennaNeural",
    "flags": []
  },
  {
    "id": "w_dank_u",
    "lemma": "dank u",
    "pos": "uitdr",
    "article": null,
    "plural": null,
    "verb_forms": null,
    "separable": null,
    "forms_seen": [],
    "zh": "谢谢您",
    "en": "thank you (polite)",
    "zh_nn": "谢谢您",
    "en_nn": "thank you (polite)",
    "first_lesson": "NN21",
    "lessons": ["NN21"],
    "audio": "audio/words/w_dank_u.mp3",
    "audio_source": "tts:nl-NL-FennaNeural",